{
  "version": 1,
  "name": "thd_1k",
  "dut": "1 kHz 正弦失真与信噪比离线验收",
  "source": {
    "instrument": "dg4062",
    "channel": 1,
    "waveform": "sine",
    "amplitude_vpp": 1.0,
    "offset_v": 0.0,
    "frequency_hz": 1000.0
  },
  "capture": {
    "source": "scope",
    "channel": 1,
    "settle_ms": 200,
    "sample_rate_hz": 256000.0,
    "samples": 16384
  },
  "simulation": {
    "gain_db": 0.0,
    "noise_snr_db": 68.0,
    "frequency_error_ppm": 5.0,
    "harmonics_dbc": {"2": -60.0, "3": -66.0, "4": -75.0},
    "seed": 20260727
  },
  "metrics": ["thd", "snr", "frequency_accuracy"],
  "pass": {
    "thd_percent_max": 1.0,
    "snr_db_min": 50.0,
    "frequency_error_ppm_max": 100.0
  },
  "safety": {
    "amplitude_vpp_max": 5.0
  }
}

